{
  "schema_version": 1,
  "id": "nexus:unrewound-tape-fee",
  "name": "Unrewound Tape Fee",
  "version": "1.0.0",
  "game": {
    "steam_app_id": 3552140,
    "supported_build_ids": ["23896268"],
    "unreal_engine": "5.4.4"
  },
  "source": {
    "provider": "nexus",
    "game_domain": "retrorewindvideostoresimulator",
    "mod_id": 283,
    "url": "https://www.nexusmods.com/retrorewindvideostoresimulator/mods/283"
  },
  "components": [
    {
      "id": "pak",
      "type": "pak",
      "root": "zzzzzzzz_UnrewoundTapeFee_P.pak",
      "required": true,
      "install_name": "zzzzzzzz_UnrewoundTapeFee_P.pak",
      "sha256": "699870c011643e7cf7e631d7815773adb7e334ca51bad9282b936e757318da28"
    }
  ],
  "incompatibilities": ["nexus:employee-fee-policy"],
  "install_notes": [
    "Use the reviewed combined package when Employee Fee Policy is selected."
  ]
}
