{
  "schema_version": 1,
  "id": "local:example-mod",
  "name": "Example Mod",
  "version": "1.0.0",
  "game": {
    "steam_app_id": 3552140,
    "supported_build_ids": ["23896268"],
    "unreal_engine": "5.4.4"
  },
  "components": [
    {
      "id": "pak",
      "type": "pak",
      "root": "payload",
      "install_name": "Example_P.pak",
      "sha256": "aaaaaaaaaaaaaaaaaaaaaaaaaaaaaaaaaaaaaaaaaaaaaaaaaaaaaaaaaaaaaaaa"
    }
  ]
}
