{
  "schema_version": 1,
  "id": "nexus:faster-returns",
  "name": "Faster Returns",
  "version": "1.1.0",
  "game": {
    "steam_app_id": 3552140,
    "supported_build_ids": ["23896268"],
    "unreal_engine": "5.4.4"
  },
  "source": {
    "provider": "nexus",
    "game_domain": "retrorewindvideostoresimulator",
    "mod_id": 271,
    "url": "https://www.nexusmods.com/retrorewindvideostoresimulator/mods/271"
  },
  "components": [
    {
      "id": "pak",
      "type": "pak",
      "root": "zzzzzzzz_FasterReturns_P.pak",
      "required": true,
      "install_name": "zzzzzzzz_FasterReturns_P.pak",
      "sha256": "a0a252f7d3efe89ae652c779336ae9bfef3c80b08e91cd27490f4c9867c4a156"
    },
    {
      "id": "ue4ss",
      "type": "ue4ss",
      "root": "FasterReturns",
      "required": true,
      "install_name": "FasterReturns"
    }
  ],
  "runtime_requirements": {
    "ue4ss_loader_policy": "ue4ss:faster-returns-supported"
  },
  "install_notes": [
    "The PAK and FasterReturns UE4SS module are required together and are managed as one hybrid package."
  ]
}
